{
  "$schema": "schemas/platform-profile.schema.json",
  "apiVersion": "fortifylab.io/v1alpha1",
  "kind": "PlatformProfile",
  "id": "fortify-24.4-eval.1",
  "maturity": "experimental",
  "scope": {"platform": "microk8s", "topology": "single-node", "aspm": false},
  "manager": {"versionRange": ">=0.4.0 <0.5.0"},
  "microk8s": {"versionRange": ">=1.28 <1.29", "architecture": "amd64", "addons": ["dns", "hostpath-storage", "helm3", "ingress", "registry"]},
  "capacity": {"cpuCores": 8, "memoryGiB": 32, "storageGiB": 100},
  "components": {
    "mysql": {"productVersion": "8.0.36", "chart": "9.19.0", "images": {"database": "8.0.36-debian-11-r2"}},
    "postgresql": {"productVersion": "17.6.0", "chart": "18.6.2", "images": {"database": "17.6.0-debian-12-r4"}},
    "ssc": {"productVersion": "24.4.2.0009", "chart": "24.4.2-1", "images": {"webapp": "24.4.2.0009"}},
    "scancentral-sast": {"productVersion": "24.4", "chart": "24.4.0-2", "images": {"controller": "24.4.0.0060", "sensor": "24.4.1"}},
    "lim": {"productVersion": "24.4", "chart": "24.4.0-3", "images": {"server": "chart-24.4.0-3-default"}},
    "scancentral-dast-core": {"productVersion": "24.4", "chart": "24.4.0-2", "images": {"api": "24.4.ubi.9", "config": "24.4.ubi.9", "connect": "24.4.ubi.9", "global-service": "24.4.ubi.9", "two-factor": "24.4.ubi.9"}},
    "scancentral-dast-scanner": {"productVersion": "24.4", "chart": "24.4.0-2", "images": {"scanner": "24.4.ubi.9", "wise": "24.4.ubi.9"}}
  },
  "evidence": {"record": "evidence/fortify-24.4-eval.1.json", "level": "static"},
  "knownLimitations": [
    "No representative licensed clean install or upgrade has been run.",
    "The LIM image is selected by the pinned chart; its immutable digest has not been recorded.",
    "The DAST chart values include moving third-party tags, so registry reachability does not prove reproducibility."
  ],
  "cleanInstall": {"target": "fresh single-node MicroK8s lab", "status": "not-run"},
  "upgrade": {"allowedSources": [], "forwardMigration": "Select a newer non-unsupported profile whose allowedSources names this profile, then follow its migration and rollback guidance."}
}
